789,789,790,NCT04007224,,Intranasal Oxytocin|Intravenous administration of autologous umbilical cord blood,Drug: Intranasal oxytocin|Biological: Autologous umbilical cord blood,Oxytocin|Autologous umbilical cord blood,Active Comparator|Experimental,"The clinical study evaluates in an open-label, crossover design the comparative efficacy and safety of intranasal oxytocin and autologous umbilical cord blood for improving the functioning of children with autistic spectrum disorder",Umbilical Cord Blood vs Personalized Treatments for Improving Autistic Disorder,felicians11@gmail.com,Felician Stancioiu,30-Mar-22,Anticipated,Autistic Spectrum Disorder,Autistic|Autistic Spectrum Disorder|Autistic Spectrum Disorder,Non-Randomized,Parallel Assignment,None (Open Label),Treatment,,790,,"Inclusion Criteria:||Subject and caregiver are both able to understand English clearly and caregiver can read and write English to complete study assessments|Males aged 13-40 years (inclusive)|Has FXS with molecular genetic confirmation of the full FMR1 mutation (>200 CGG repeats).|Weight ≥45 kg|Is in general good health as deemed by the Investigator, determined by physical examination, medical history, and laboratory tests|If receiving sertraline, is on a stable, well-tolerated dose for the previous 3 months with no further changes anticipated||Exclusion Criteria:||Active or history of peptic or gastric ulcer or hemorrhage|Any chronic major medical comorbid condition deemed by the Investigator as presenting added risk to the subject, including but not limited to refractory hypertension, kidney disease, or liver disease|Diagnosed with diabetes (Type 1 or II) or receiving any anti-diabetic medication|Unstable seizure disorder defined by any seizure within 6 months prior to baseline visit and/or a change in any anti-convulsant drug dosing in the 60 days prior to study entry|Individual or family history of myocardial infarction, TIA, peripheral arterial disease, stroke or other significant cardiovascular disease|Chronic use of NSAIDs or other anti-inflammatory agents|Currently taking or have taken any cannabidiol (CBD) preparation within 30 days prior to randomization|Currently taking or have taken sulindac within 30 days prior to randomization|Changes in chronic psychotropic or anti-convulsant (where taken for reasons other than seizure control) drug treatment within 30 days prior to randomization|History of adverse effects of sulindac or other NSAIDS that would prevent safe study completion|Unable or unwilling to take oral medication (whole capsule) or history of dysphagia or malabsorption|Has current or suspected symptoms of COVID-19 including, but not limited to fever, dry cough, new loss or change of smell or taste, myalgia, fatigue, or a positive COVID-19 test.|Has abnormal baseline laboratory assessments including, but not limited to alanine aminotransferase (ALT) or aspartate aminotransferase (AST) >1.5 × the upper limit of normal (ULN), total bilirubin or creatinine >1.0 × ULN, or other clinically relevant laboratory abnormality|Has a clinically significant abnormal electrocardiogram (ECG), heart rate, or blood pressure at screening as judged by the Investigator|Has received an investigational drug (either approved or not approved) in any prior clinical study within 30 days or 5 half-lives (whichever is longer) prior to screening",36,Anticipated,Male,No,,"Sulindac, dose strength 1|Sulindac, dose strength 2|Placebo",Sulindac Capsule|Sulindac Capsule|Placebo Capsule,"Sulindac, dose strength 1|Sulindac, dose strength 2|Placebo",Drug|Drug|Drug,11/12/21,Actual,11-Nov-21,INDUSTRY,Healx Limited,Aurora|Atlanta|Chicago|Boston|New York,United States|United States|United States|United States|United States,Childrens Colorado Hospital|Emory University Hospital|Rush University Medical Centre|University of Massachusetts|Mount Sinai Hospital,790,Colorado|Georgia|Illinois|Massachusetts|New York,40 Years,13 Years,"A Phase IIa, Double-blind, Placebo-controlled Adaptive Design Study to Explore the Safety and Efficacy of Sulindac (HX02_01) Alone and Subsequently in Combination With Other Drugs in Adolescent and Adult Males With Fragile X Syndrome (FXS)",Healx Limited,Rush University,Not yet recruiting,No,Phase 2,Jul-22,Anticipated,The Clinician/Caregiver FXS Domain Specific Concerns allows for the subject specific symptoms of concern to be assessed on an ongoing basis throughout the study. The specific concerns that correlate to the 6 domains (Clinician) or 3 Domains (Caregiver) will be assessed using a 7-point Likert scale.,"NIH Cognitive Toolbox|Clinical Global Impression - I|Aberrant Behavior Checklist|Anxiety, Depression, and Mood Scale|FXS Domain Specific Concerns",Day 70|Day 70|Day 70|Day 70|Day 70,,Sponsor,,790,,,,,,,17-Jan-19,Actual,Oct-21,Child,5-Jul-19,Actual,28-Jan-19,1-Jul-19,Interventional,16-Dec-21,,No
833,833,834,NCT02874690,SAT,Placebo pill received,Drug: Placebo|Drug: Methylphenidate,Placebo|Methylphenidate,Placebo Comparator|Experimental,The overall goal of this research is to use neurophysiological measures to profile strengths and deficits for Attention Deficit Hyperactivity Disorder co-morbidity in Autism Spectrum Disorder to clarify diagnosis and to predict treatment response.,Eye Tracking as a Predictor of Methylphenidate Response in Autism With ADHD,,,3-Aug-17,Actual,Autism Spectrum Disorder|Attention Deficit Hyperactivity Disorder,Autism|Autism Spectrum Disorder|Hyperactivity|Attention Deficit Hyperactivity Disorder,Randomized,Parallel Assignment,Quadruple,Basic Science,Participant|Care Provider|Investigator|Outcomes Assessor,834,,"Inclusion Criteria:||Female subjects 5 to 20 years of age, inclusive, at Screening|Body weight ≥12 kg at Screening|Can swallow the study medication provided as a liquid solution or can take it by gastrostomy tube|Has classic/typical Rett syndrome (RTT)|Has a documented disease-causing mutation in the MECP2 gene|Has a stable pattern of seizures, or has had no seizures, within 8 weeks of Screening|Subjects of childbearing potential must abstain from sexual activity for the duration of the study and for at least 30 days thereafter or must agree to use acceptable methods of contraception. Subject must not be pregnant or breastfeeding.|The subject's caregiver is English-speaking and has sufficient language skills to complete the caregiver assessments|Subject and caregiver(s) must reside at a location to which study drug can be delivered and have been at their present residence for at least 3 months prior to Screening||Exclusion Criteria:||Has been treated with insulin within 12 weeks of Baseline|Has current clinically significant cardiovascular, endocrine (such as hypo- or hyperthyroidism, Type 1 diabetes mellitus, or uncontrolled Type 2 diabetes mellitus), renal, hepatic, respiratory or gastrointestinal disease (such as celiac disease or inflammatory bowel disease) or has major surgery planned during the study|Has a history of, or current, cerebrovascular disease or brain trauma|Has significant, uncorrected visual or uncorrected hearing impairment|Has a history of, or current, malignancy|Has a known history or symptoms of long QT syndrome||Additional inclusion/exclusion criteria apply. Patients will be evaluated at screening to ensure that all criteria for study participation are met. Patients may be excluded from the study based on these assessments (and specifically, if it is determined that their baseline health and condition do not meet all pre-specified entry criteria).",187,Actual,Female,No,,Drug - Trofinetide|Placebo,"Trofinetide solution administered based on the subject's weight at Baseline, twice daily for 12 weeks|Trofinetide placebo solution administered based on the subject's weight at Baseline, twice daily for 12 weeks",Trofinetide|Placebo,Drug|Other,12/1/21,Actual,29-Nov-21,INDUSTRY,ACADIA Pharmaceuticals Inc.,Birmingham|Phoenix|La Jolla|Sacramento|Aurora|Tampa|Atlanta|Chicago|Baltimore|Boston|Saint Paul|Saint Louis|Bronx|Chapel Hill|Cincinnati|Cleveland|Philadelphia|Greenwood|Nashville|Houston|Seattle,United States|United States|United States|United States|United States|United States|United States|United States|United States|United States|United States|United States|United States|United States|United States|United States|United States|United States|United States|United States|United States,"University of Alabama at Birmingham|Translational Gemomics Research Institute (TGen)|University of California, San Diego|UC Davis MIND Institute|Children's Hospital Colorado|Children Medical Services|Emory Genetics Clinical Trial Center|Rush University Children's Hospital|Kennedy Krieger Institute - Clinical Trials Unit|Boston Children's Hospital Harvard Medical School|Gillette Children's Specialty Healthcare|Washington University School of Medicine|Montefiore Medical Center, Children's Hospital at Montefiore|The University of North Carolina at Chapel Hill|Cincinnati Children's Hospital Medical Center|Cleveland Clinic|Children's Hospital of Philadelphia|Greenwood Genetic Center|Vanderbilt University Medical Center|Texas Children's Hospital|Seattle Children's",834,Alabama|Arizona|California|California|Colorado|Florida|Georgia|Illinois|Maryland|Massachusetts|Minnesota|Missouri|New York|North Carolina|Ohio|Ohio|Pennsylvania|South Carolina|Tennessee|Texas|Washington,20 Years,5 Years,"A Randomized, Double-Blind, Placebo-Controlled, Parallel-Group Study of Trofinetide for the Treatment of Girls and Women With Rett Syndrome",ACADIA Pharmaceuticals Inc.,,Completed,Yes,Phase 3,28-Oct-21,Actual,"The scale includes 45 items, 39 of them grouped into 8 subscales, whose ratings reflect the severity and frequency of symptoms. Items are rated as ""0"" (not true), ""1"" (somewhat or sometimes true), or ""2"" (very true). The 8 subscales include general mood, breathing problems, hand behavior, face movements, body rocking/expressionless face, night-time behaviors, fear/anxiety, and walking/standing.|To rate how much the subject's illness has improved or worsened relative to a baseline state, a 7-point scale is used from 1=very much improved, 2=much improved, 3=minimally improved, 4=no change, 5=minimally worse, 6=much worse, 7=very much worse.",Rett Syndrome Behaviour Questionnaire (RSBQ) total score - Change from Baseline to Week 12|Clinical Global Impression-Improvement (CGI-I) Score at Week 12,12 Weeks Treatment Duration|12 Weeks Treatment Duration,,Sponsor,,834,,,,"SICI is a TMS measure of the efficiency of inhibitory interneurons in the primary motor cortex.|EEG will be used to assess the electrophysiologic aspects of behavioral computerized testing, behavior, or motor function.",Change in Short Interval IntraCortical Inhibition (SICI) using Transcranial Magnetic Stimulation (TMS)|Change in Resting State Electroencephalogram (EEG),Pre-dose; Approximately 90 minutes post-dose of methylphenidate|Pre-dose; Approximately 90 minutes post-dose of methylphenidate,19-Feb-16,Actual,Mar-20,Child|Adult,22-Aug-16,Estimate,4-Mar-16,17-Aug-16,Interventional,16-Dec-21,,Yes
873,873,874,NCT00829439,,"Other Names:||Sinemet L-dopa||Dosages are based on levodopa.||Each cohort of 3 subjects will be placed on an increasing dose of levodopa (2, 5, 10, and 15 mg/kg/day) for 1 week, provided subjects in the preceding cohort tolerated the lower dose.||Levodopa/Carbidopa is a combined formulation that will be dispensed as capsules. It should be taken 3 times a day.",Drug: Levodopa/Carbidopa (4:1),Levodopa/Carbidopa,Experimental,This study is designed to determine the highest dose of levodopa/carbidopa that can be tolerated without any serious side effects by children with Angelman syndrome.||It has been hypothesized that levodopa may lead to an improvement in the neurodevelopment and abnormal movements (e.g. tremors) in children with Angelman syndrome.||Data from this study will be used to design a phase II trial to determine the efficacy of levodopa in treating children with Angelman syndrome.,Study on Tolerability of Levodopa/Carbidopa in Children With Angelman Syndrome,,,Jun-10,Actual,Angelman Syndrome,Syndrome|Angelman Syndrome|Angelman Syndrome,,Single Group Assignment,None (Open Label),Treatment,,874,"Autism is a developmental disability with increasing prevalence in our society. Currently one out of fifty-nine children in the United States has this condition. Many children with autism experience behavioral dysregulation such as irritability and aggression.||Currently, there are two FDA approved atypical antipsychotic medications that treat irritability in children with autism. These are aripiprazole and risperidone. While it is thought that aripiprazole may cause less weight gain than risperidone, clinically this has not been proven.||Understanding the relative risk of ATAP-induced weight gain that results from risperidone versus aripiprazole in a real-world setting could help guide the choice of medical intervention and reduce the cardiometabolic risks, and, most critically, address the limitations of current studies, which have not been able to provide clear clinical insights given the difficulty with having a representative and robust number of patients enrolled.||To be enrolled in this study, participants must be younger than 18 years of age, on the autism spectrum, have behavioral dysregulation, be naive to treatment with atypical antipsychotics and be seen either in the Division of Developmental Medicine or Child and Adolescent Psychiatry at Vanderbilt University Medical Center.||For enrolled patients, the ordering provider will see an order set, randomized to either aripiprazole or risperidone. They will then choose the recommended antipsychotic that the patient has been randomized to, or override the prompt. If the provider overrides the prompt, they will be asked to provide a reason for not choosing the recommended option.||The outcome measure for this study will be weight gain at a 3 month follow-up visit.",Inclusion Criteria:||age 17 years and young|diagnosed with autism|have behavior problems|seen in Vanderbilt clinic|naïve to atypical antipsychotics||Exclusion Criteria:||18 years or older|history of atypical antipsychotic use|not diagnosed with autism,350,Anticipated,All,Accepts Healthy Volunteers,No,Treatment with Aripiprazole|Treatment with Risperidone,Comparing two FDA approved medications for treatment of irritability in autism,Comparison of Risperidone and Aripiprazole,Drug,12/14/21,Actual,10-Dec-21,OTHER,Vanderbilt University Medical Center,Nashville,United States,Division of Developmental Medicine,874,Tennessee,17 Years,,Pragmatic Trial Comparing Weight Gain in Children With Autism Taking Risperidone Versus Aripiprazole,Vanderbilt University Medical Center,Vanderbilt University Medical Center,Recruiting,No,Phase 4,1-Jul-24,Anticipated,change in weight,weight gain,3 months,,Principal Investigator,,874,Estimate,5-Aug-16,29-Sep-16,,,,Jan-09,,Sep-16,Child,27-Jan-09,Estimate,26-Jan-09,26-Jan-09,Interventional,16-Dec-21,,No
980,980,981,NCT03423160,,"Right-handed children, ages 8.0-12.9, diagnosed with high-functioning ASD (and no co-morbid conditions, excluding anxiety disorders)|Right-handed children, ages 8.0-12.9, with no neurological or psychiatric diagnoses, currently or by history",Other: None--observational|Other: None--observational,Autism|Control,,"There is long-standing recognition that people with autism spectrum disorders (ASD) have difficulty imitating others' actions; some investigators have highlighted impaired imitation as being a core contributor to the development of autism. What is yet unknown is precisely how imitation in children with ASD differs from that of typically developing peers.The investigators have identified a task parameter that separates preserved from impaired gesture imitation in ASD: children with ASD have difficulty imitating when the task requires two separate movement elements be coordinated simultaneously. By contrast, imitation is relatively preserved when movement elements are performed serially. The coordination of simultaneous movements is a hallmark of actions performed in the real world. With an eye to optimizing common therapies that depend heavily on imitation, the next step is to tease apart where, in the chain from perception to action, the capacity limitation in simultaneous processing lies. This study will be conducted in about two days and will involve imitating gestures that are presented via video. In addition, an EEG will record the brain's electrical activity during certain tasks to assess how the brain responds when the imitation task is more or less difficult. Several other clinical and behavioral measures will also be used.",A Novel Framework for Impaired Imitation in ASD,levinem@kennedykrieger.org|ewen@kennedykrieger.org,"Michael Levine, MS|Joshua Ewen, MD",Jun-23,Anticipated,Autism Spectrum Disorder,Autism Spectrum Disorder,,,,,,981,,"Inclusion Criteria:||Has completed the Week 12/End-of-treatment visit of the antecedent study, Study ACP-2566-003|Met all entry criteria for the antecedent study|May benefit from long-term treatment with open-label trofinetide in the judgment of the Investigator|Can still swallow the study medication provided as a liquid solution or can take it by gastrostomy tube|The subject's caregiver is English-speaking and has sufficient language skills to complete the caregiver assessments|Subject and caregiver(s) must reside at a location to which study drug can be delivered and have been at their present residence for at least 3 months prior to Baseline||Exclusion Criteria:||Began treatment with growth hormone during the antecedent study|Began treatment with IGF-1 during the antecedent study|Began treatment with insulin during the antecedent study|Has developed a clinically significant cardiovascular, endocrine (such as hypo- or hyperthyroidism, Type 1 diabetes mellitus, or uncontrolled Type 2 diabetes mellitus), renal, hepatic, respiratory, or gastrointestinal disease (such as celiac disease or inflammatory bowel disease) or has major surgery planned during the study|Subject is judged by the Investigator or the Medical Monitor to be inappropriate for the study due to AEs, medical condition, or noncompliance with investigational product or study procedures in the antecedent study|Has a clinically significant abnormality in vital signs at Baseline|Has a QTcF interval of >450 ms on the Baseline ECG performed before the first dose of trofinetide is given in the present study|Has developed a clinically significant ECG finding during the antecedent study||Additional inclusion/exclusion criteria apply. Patients will be evaluated at baseline to ensure that all criteria for study participation are met. Patients may be excluded from the study based on these assessments (and specifically, if it is determined that their baseline health and condition do not meet all prespecified entry criteria).",180,Anticipated,Female,No,No,Trofinetide,"Trofinetide solution of 30-60 mL based on subject's weight at Baseline, administered twice daily by mouth or gastrostomy tube (G-tube)",Trofinetide,Drug,12/1/21,Actual,29-Nov-21,INDUSTRY,ACADIA Pharmaceuticals Inc.,Birmingham|Phoenix|La Jolla|Sacramento|Aurora|Tampa|Atlanta|Chicago|Baltimore|Boston|Saint Paul|Saint Louis|Bronx|Chapel Hill|Cincinnati|Cleveland|Philadelphia|Greenwood|Nashville|Houston|Seattle,United States|United States|United States|United States|United States|United States|United States|United States|United States|United States|United States|United States|United States|United States|United States|United States|United States|United States|United States|United States|United States,"University of Alabama at Birmingham|Translational Genomics Research Institute (TGen)|University of California, San Diego|UC Davis MIND Institute|Children's Hospital Colorado|Children Medical Services|Emory Genetics Clinical Trial Center|Rush University Medical Center|Kennedy Krieger Institute - Clinical Trials Unit|Boston Children's Hospital|Gillette Children's Specialty Healthcare|Washington University School of Medicine, St. Louis Children's Hospital|Montefiore Medical Center, Children's Hospital at Montefiore|The University of North Carolina at Chapel Hill|Cincinnati Children's Hospital Medical Center|Cleveland Clinic|Children's Hospital of Philadelphia|Greenwood Genetic Center|Vanderbilt University Medical Center|Texas Children's Hospital|Seattle Children's",981,Alabama|Arizona|California|California|Colorado|Florida|Georgia|Illinois|Maryland|Massachusetts|Minnesota|Missouri|New York|North Carolina|Ohio|Ohio|Pennsylvania|South Carolina|Tennessee|Texas|Washington,21 Years,5 Years,"A 40-Week, Open-label Extension Study of Trofinetide for the Treatment of Girls and Women With Rett Syndrome",ACADIA Pharmaceuticals Inc.,,"Active, not recruiting",No,Phase 3,Oct-22,Anticipated,,"Percentage of subjects with treatment-emergent adverse events (TAEs), percentage of subjects with serious adverse events (SAEs), and percentage of subjects withdrawals due to adverse events (AEs)|Number of subjects with post-Baseline potentially clinically important changes in ECG|Percentage of subjects with post-Baseline potentially clinically important changes in ECG|Number of subjects with post-Baseline potentially clinically important changes in vital signs|Percentage of subjects with post-Baseline potentially clinically important changes in vital signs|Number of subjects with post-Baseline potentially clinically important changes in body weight|Percentage of subjects with post-Baseline potentially clinically important changes in body weight|Number of subjects with post-Baseline potentially clinically important changes in laboratory parameters|Percentage of subjects with post-Baseline potentially clinically important changes in laboratory parameters",40 Weeks Treatment Duration|40 Weeks Treatment Duration|40 Weeks Treatment Duration|40 Weeks Treatment Duration|40 Weeks Treatment Duration|40 Weeks Treatment Duration|40 Weeks Treatment Duration|40 Weeks Treatment Duration|40 Weeks Treatment Duration,,Sponsor,,981,,,,"Event-related spectral perturbation associated with imitation task (and control tasks), at sites reflecting the activity of visuo-motor networks",EEG measures of brain activity during gesture imitation,Day 1 or 2,24-Apr-18,Actual,Oct-21,Child,6-Feb-18,Actual,24-Jan-18,30-Jan-18,Observational,16-Dec-21,,No
