,index,Rank,NCTId,Acronym,ArmGroupDescription,ArmGroupInterventionName,ArmGroupLabel,ArmGroupType,BriefSummary,BriefTitle,CentralContactEMail,CentralContactName,CompletionDate,CompletionDateType,Condition,ConditionBrowseLeafAsFound,DesignAllocation,DesignInterventionModel,DesignMasking,DesignPrimaryPurpose,DesignWhoMasked,Rank,DetailedDescription,EligibilityCriteria,EnrollmentCount,EnrollmentType,Gender,HealthyVolunteers,IPDSharing,InterventionArmGroupLabel,InterventionDescription,InterventionName,InterventionType,LastUpdatePostDate,LastUpdatePostDateType,LastUpdateSubmitDate,LeadSponsorClass,LeadSponsorName,LocationCity,LocationCountry,LocationFacility,Rank,LocationState,MaximumAge,MinimumAge,OfficialTitle,OrgFullName,OverallOfficialAffiliation,OverallStatus,OversightHasDMC,Phase,PrimaryCompletionDate,PrimaryCompletionDateType,PrimaryOutcomeDescription,PrimaryOutcomeMeasure,PrimaryOutcomeTimeFrame,ReferenceCitation,ResponsiblePartyType,ResultsFirstPostDate,Rank,ResultsFirstPostDateType,ResultsFirstSubmitDate,ResultsFirstSubmitQCDate,SecondaryOutcomeDescription,SecondaryOutcomeMeasure,SecondaryOutcomeTimeFrame,StartDate,StartDateType,StatusVerifiedDate,StdAge,StudyFirstPostDate,StudyFirstPostDateType,StudyFirstSubmitDate,StudyFirstSubmitQCDate,StudyType,VersionHolder,WhyStopped,Placebo
107,107,108,NCT03664232,Envision,Participants will self-administer 25 milligram (mg) JNJ-42165279 tablets orally twice daily for 12 weeks.|Participants will self-administer matching placebo tablets orally twice daily for 12 weeks.,Drug: JNJ-42165279|Drug: Placebo,JNJ-42165279|Placebo,Experimental|Placebo Comparator,The purpose of this study is to evaluate the efficacy of JNJ-42165279 compared with placebo in the improvement of symptoms of Autism Spectrum Disorder (ASD) during 12 weeks of treatment using the Autism Behavior Inventory (ABI).,"A Study to Investigate the Efficacy, Safety, and Tolerability of JNJ-42165279 in Adolescent and Adult Participants With Autism Spectrum Disorder",JNJ.CT@sylogent.com,Study Contact,28-Jul-22,Anticipated,Autism Spectrum Disorder,Autism|Autism Spectrum Disorder|Autism Spectrum Disorder,Randomized,Parallel Assignment,Double,Treatment,Participant|Investigator,108,,"Inclusion Criteria:||Diagnosis of Autism Spectrum Disorder (ASD) according to Diagnostic and Statistical Manual of Mental Disorders - 5th Edition (DSM-5) criteria and made or confirmed using the Autism Diagnostic Observation Schedule, 2nd edition (ADOS-2) (minimum score of 8 [autism spectrum])|Otherwise healthy for their age group or medically stable with or without medication on the basis of physical examination, medical history, vital signs, 12-lead electrocardiogram (ECG), and clinical laboratory tests|Have a composite score on Kaufman Brief Intelligence Test, Second Edition (KBIT-2) of at least 60|Must live with a parent or primary caregiver or, if not, during each week he/she must either (A) spend at least 3 hours a day for at least 4 days or, (B) spend the weekend with a parent or primary caregiver|Any pharmacologic, diet, or behavioral intervention for ASD must have begun at least 1 month prior to the baseline visit and continue unchanged through the treatment period, or have ended at least 1 month prior to the baseline visit|Must be able to swallow the study medication whole and self-administer medication if living independently or have a parent or caregiver be able to administer medication|Must agree to abide by the birth control requirements during the study and for 3 months after the last dose||Exclusion Criteria:||Current or recent history of clinically significant suicidal ideation within the past 6 months, or a history of suicidal behavior within the past year|Use of a drug with moderate/strong cytochrome P450 (CYP)3A4 inhibiting or inducing properties at, or prior to, screening that is not discontinued at least within 1 month prior to Day 1|History of drug or alcohol use disorder according to DSM-5 criteria within 6 months before screening or positive test result(s) for alcohol or drugs of abuse (except if related to current treatment)|Currently taking or has taken within the past month recreational or medically prescribed cannabis",80,Anticipated,All,No,,JNJ-42165279|Placebo,Participants will receive 25 mg JNJ-42165279 orally twice daily for 12 weeks.|Participants will receive a matching placebo orally twice daily for 12 weeks.,JNJ-42165279|Placebo,Drug|Drug,12/9/21,Actual,7-Dec-21,INDUSTRY,"Janssen Research & Development, LLC",Dothan|Phoenix|Orange|Orlando|Lake Charles|Baltimore|New York|Orangeburg|Cincinnati|Oklahoma City|Austin|Seattle,United States|United States|United States|United States|United States|United States|United States|United States|United States|United States|United States|United States,"Harmonex Neuroscience Research|Southwest Autism Research and Resource Center|NRC Research Institute|APG Research, LLC|Lake Charles Clinical Trials|Sheppard Pratt Health System|New York Presbyterian Hospital|Nathan Kline Institute|Cincinnati Children's Hospital Medical Center|Cutting Edge Research Group|BioBehavioral Research of Austin, PC|Seattle Children's Hospital",108,Alabama|Arizona|California|Florida|Louisiana|Maryland|New York|New York|Ohio|Oklahoma|Texas|Washington,35 Years,13 Years,"A Randomized, Double-Blind, Placebo-Controlled, Parallel Group, Multicenter Study Investigating the Efficacy, Safety, and Tolerability of JNJ-42165279 in Adolescent and Adult Subjects With Autism Spectrum Disorder","Janssen Research & Development, LLC","Janssen Research & Development, LLC",Recruiting,Yes,Phase 2,28-Mar-22,Anticipated,"Change from baseline in the ABI core domain score will be reported. ABI is a 62-item questionnaire completed on a web/mobile application or on paper. It is part of the Janssen Autism Knowledge Engine (JAKE), a research tool that tracks outcomes in Autism Spectrum Disorder (ASD). Each ABI item is answered on 1 of 2 possible dimensions, quality (how well a person carries out a particular behavior) or frequency (how often a particular behavior occurs). Each item is rated on a scale of 0-3 (never to very often [frequency] or not at all to without help [quality]). The ABI Core Domain Score is calculated as the sum of the scores in the Social Communication Domain and the Repetitive/Restrictive Behavior Domain divided by the total number of items in these 2 domains.|Change from baseline in the ABI social communication domain score will be reported. Each item is rated on a scale of 0-3 (never to very often [frequency] or not at all to without help [quality]). The ABI social communication domain score is calculated as the sum of the scores in the social communication domain divided by the total number of items in this domain.|Change from baseline in the ABI RRB domain score will be reported. Each item is rated on a scale of 0-3 (never to very often). The ABI RRB domain score is calculated as the sum of the scores in the RRB domain divided by the total number of items in this domain.",Change from Baseline in the Autism Behavior Inventory (ABI) Core Domain Score to Day 85|Change from Baseline in ABI Social Communication Domain Score to Day 85|Change from Baseline in ABI Repetitive/Restrictive Behavior (RRB) Domain Score to Day 85,Baseline up to Day 85|Baseline up to Day 85|Baseline up to Day 85,,Sponsor,,108,,,,"Change from baseline in the ABI mood and anxiety domain score will be reported. The ABI mood and anxiety domain score is calculated as the sum of the scores in the mood and anxiety domain divided by the total number of items in this domain. Each item is rated on a scale of 0-3 (never to very often).|Change from baseline in the ABI challenging behavior domain score will be reported. The ABI challenging behavior domain score is calculated as the sum of the scores in the challenging behavior domain divided by the total number of items in this domain. Each item is rated on a scale of 0-3 (never to very often).|Change from baseline in the ABI self-regulation domain score will be reported. The ABI self-regulation domain score is calculated as the sum of the scores in the self-regulation domain divided by the total number of items in this domain. Each item is rated on a scale of 0-3 (never to very often).|Change from baseline in the ABC subscales will be reported. The ABC is a 58-item behavior rating scale used to measure behavior problems across 5 subscales: Irritability, Lethargy (Social Withdrawal), Stereotypy, Hyperactivity, Inappropriate Speech. Items are rated on a 4-point scale (ranging from 0 [not at all a problem] to 3 [the problem is severe in degree]).|Change from baseline in the ABI-S scale domains will be reported. ABI-S is the shorter version of the ABI. It consists of 24 items across 5 areas, social communication, RRB, mood and anxiety, challenging behavior, and self-regulation. Each ABI-S domain score is calculated as the sum of the scores in the ABI-S domain divided by the total number of items in this domain. Each item is rated on a scale of 0-3 (never to very often [frequency] or not at all to without help [quality]).|Change from baseline in the ABI-C domains will be reported. The ABI-C is designed to capture the behaviors of a person with ASD that have occurred over the past week. There are 14 items across each of the 5 domains (social communication, restrictive behaviors, mood and anxiety, self regulation and challenging behavior). The clinician rates the severity of behaviors and level of impairment on a scale of 1 (none) to 7 (very severe).|Change from baseline in the CGI-S scale score will be reported. The CGI-S rating scale is a global assessment that measures the clinician's impression of the severity of illness of the participant. A rating scale of 1-7 is used, with 1=""normal, not at all ill"" and 7=""among the most extremely ill"".|Change from baseline in the RBS-R scale score will be reported. The RBS-R is a 43-item rating scale to indicate occurrence of repetitive behaviors and degree to which a behavior is a problem on a range between 0 to 3, where 0 = behavior does not occur and 3 = behavior occurs and is a severe problem.|Change from baseline in the ZBI scale score will be reported. The ZBI short version scale consists of 22 items designed to assess the psychological burden experienced by a caregiver. Responses range from 0-4, where 0 = never and 4 = nearly always.|Change from baseline in the CASI-Anx scale score will be reported. CASI-Anx is a 21-point anxiety subscale of the full CASI. Responses will range from 0 to 3, where 0 = never and 3 = very often.|Change from baseline in the SRS-2 scale score will be reported. The SRS-2 is a 65-item scale that measures social impairment and includes 5 subscales. Responses range from 1 to 4, where 1 = Not true and 4 = almost always true.|Change from baseline in the Caregiver GI-S scale score will be reported. The Caregiver GI-S is a single-item instrument that asks caregivers to rate their overall impression of the severity of their child's ASD symptoms. Responses range from 1 to 7, where 1 = None and 7 = Severe.|The Caregiver Assessment of Treatment is a 3-item questionnaire. Caregivers rate their global impression of improvement in their child's autism, whether there was improvement in specific symptoms, and their interest in having their child continue the study medication. One item uses a scale of 1 (very much improved) to 7 (very much worse), another item includes a Yes/No checklist, and another item uses a scale of 1 (not at all interested) to 5 (extremely interested).|The participant will be asked to give his/her impression of overall improvement in ASD symptoms using a single-item instrument, the Self GI-I. Responses will range from 1 to 7, where 1 = Very much better and 7 = Very much worse.|The CGI-I is a single-item instrument that measures the clinician's global impression of improvement in the participant from the initiation of treatment. A 7-point scale is used, with 1=very much improved and 7=very much worse.",Change from Baseline in the ABI Mood and Anxiety Domain Score to Day 85|Change from Baseline in the ABI Challenging Behavior Domain Score|Change from Baseline in the ABI Self-Regulation Domain Score|Change from Baseline in the Aberrant Behavior Checklist (ABC) Subscales|Change from Baseline in the Autism Behavior Inventory-Short Form (ABI-S) Scale Domains|Change from Baseline in the Autism Behavior Inventory-Clinician Interview (ABI-C) Domains|Change from Baseline in the Clinical Global Impression-Severity (CGI-S) Scale Score|Change from Baseline in the Repetitive Behavior Scale - Revised (RBS-R) Scale Score|Change from Baseline in the Zarit Burden Interview (ZBI) Scale Score|Change from Baseline in the Child Adolescent Symptom Inventory - Anxiety (CASI-Anx) Scale Score|Change from Baseline in the Social Responsiveness Scale 2 (SRS-2) Score|Change from Baseline in the Caregiver Global Impression of Severity (Caregiver GI-S)|Caregiver Assessment of Treatment Score|Self Global Impression of Improvement (Self GI-I) Score|Clinical Global Impression-Improvement (CGI-I),Baseline up to Day 85|Baseline up to Day 85|Baseline up to Day 85|Baseline up to Day 85|Baseline up to Day 85|Baseline up to Day 85|Baseline up to Day 85|Baseline up to Day 85|Baseline up to Day 85|Baseline up to Day 85|Baseline up to Day 85|Baseline up to Day 85|Day 85|Day 85|Day 85,7-Nov-18,Actual,Dec-21,Child|Adult,10-Sep-18,Actual,7-Sep-18,7-Sep-18,Interventional,16-Dec-21,,Yes
372,372,373,NCT03123146,,"Functional Behavior-Based Cognitive Behavioral Therapy: Group activities, individual work in parent-child dyads, group parent training, and social skills exercises.|Children assigned to this condition received ""usual care,"" meaning that they could continue with any services. This group acted as a control group whereby access to intervention was patient-directed.",Behavioral: Functional Behavior-Based Cognitive Behavioral Therapy,Fb-Cognitive Behavioral Therapy|Treatment as Usual (TAU),Experimental|No Intervention,"Individuals with high functioning autism spectrum disorder (ASD) frequently experience obsessions and/or compulsions that are similar to those specified in Diagnostic and Statistical Manual of Mental Disorders (5th ed.; DSM-5) criteria for obsessive compulsive disorder (OCD). However, little research exists on effective interventions for OCD symptoms (referred to as OCBs) in ASD. In a randomized controlled trial, a manualized functional behavior-based cognitive-behavior therapy (Fb-CBT) consisting of traditional CBT components (psychoeducation and mapping, cognitive-behavioral skills training, exposure, and response prevention) as well as function-based behavioral assessment will be evaluated. Participants will be assigned randomly to Fb-CBT or treatment as usual (TAU). Primary and secondary outcome measures will be used to evaluate the efficacy of the treatment, and will be administered at pre and post-intervention as well as six month follow-up.",Cognitive Behavioural Therapy for Children With Autism Spectrum Disorder and Obsessive Compulsive Behaviour,,,1-Feb-14,Actual,Autism Spectrum Disorder|Obsessive-Compulsive Behavior,Autism|Autism Spectrum Disorder|Compulsive Behavior|Autism Spectrum Disorder,Randomized,Parallel Assignment,Single,Treatment,Outcomes Assessor,373,"Children with ASD suffer from both mental and physical symptoms that affect quality of life and severely disrupt family well-being. The objective of the protocol is to test the impact of Omega 3-6 on pre-specified biological signatures (IL-1β, IL-2, and IFNγ) and to correlate changes in the biological signatures with changes in ASD symptoms. Fatty acid supplements are natural products with anti-inflammatory properties often used for treatment of ASD symptoms, but the efficacy remains unproven.","Inclusion Criteria:||Age 2-6 years old|ASD diagnosis at Nationwide Children's Hospital within the prior 6 months|ADOS-2 score in ""autism"" (severe) range|English is primary language||Exclusion Criteria:||Fatty acid supplementation in the past 6 months|Consumes fatty fish more than 3 times per week|Still breastfeeding or formula feeding|Quadriparesis|Deafness|Blindness|Seizure disorder diagnosis|Autoimmune disorder including Type 1 Diabetes, Fragile X, Rett, Angleman Syndromes, Tuberous Sclerosis|Feeding problems precluding consumption of the supplement|Ingredient allergy (canola, fish, or borage seed)|Planned surgeries scheduled within the time frame of trial participation",96,Anticipated,All,No,No,Long chain polyunsaturated fatty acid (LCPUFA) Oil Supplement|Canola Oil,"25 mg/kg, 50 mg/kg, or 75 mg/kg of GLA+EPA+DHA as Omega 3-6 oil to be administered twice per day by mouth for 90 days|Equal volume (25 mg/kg, 50 mg/kg, or 75 mg/kg) of placebo (canola) oil to be administered twice per day by mouth for 90 days",LCPUFA Oil Supplement|Canola Oil Placebo,Drug|Dietary Supplement,12/13/21,Actual,10-Dec-21,OTHER,Sarah Keim,Columbus,United States,Nationwide Children's Hospital,373,Ohio,6 Years,2 Years,Fatty Acid Supplements Alter Biological Signatures and Behavior in Children With Autism Spectrum Disorder (ASD),Nationwide Children's Hospital,Nationwide Children's Hospital|Nationwide Children's Hospital,Enrolling by invitation,Yes,Phase 2,31-Oct-23,Anticipated,"Change in PDDBI Autism Composite t-score. Autism Composite t-scores range from 0-100 (mean=50; SD=10). T scores ranging 40-60 are characteristic of most cases of autism. Higher scores indicate greater severity. T scores for the Social Approach Behaviors and Expressive Language domains are summed and subtracted from the sum of the T scores for the Sensory/Perceptual Approach Behaviors, Ritualisms/Resistance to Change, Social Pragmatic Problems, and Semantic/Pragmatic Problems domains to obtain the Autism Composite t-score.",Pervasive Developmental Disorder Behavior Inventory (PDDBI) - Autism Composite,Baseline to 90 days post randomization.,,Sponsor-Investigator,,373,,,,"The final item on the RBS-R asks caregivers to rate on a scale from 1 to 100 how much OCBs affect the child and the people around them (1 is not a problem to 100 is as bad as can be imagined; Bodfish et al., 1999).|A 33-item, parent-report questionnaire that assesses OCD-related impairment in various areas of the child's life, including school, social, and home/family activities. For each item, the parent rates the child's level of impairment on a 4-point Likert scale from 0 (not at all) to 3 (very much).|A Likert-type scale ranging from 1 (desired post-treatment levels of OCBs) to 3 (partial improvement from pre-treatment levels) to 5 (pre-treatment levels of OCBs) was used by parents to rate OCBs.",Change in Repetitive Behavior Scale 100 (RBS_100)|Change in The child Obsessive-Compulsive Impact Scale-Revised (COIS-R)|Parent OCB Rating Scale.,"Assessment occurred at baseline and 2 weeks following the end of treatment, as well as at follow-up (6 months following the cessation of treatment)|Assessment occurred at baseline and 2-weeks following the end of treatment, as well as at follow-up (6 months following the cessation of treatment)|Scale was completed by parents at baseline, each day throughout the 9-week treatment period, and at follow-up (6 months following the cessation of treatment)",1-Jun-10,Actual,Apr-17,Child,21-Apr-17,Actual,13-Apr-17,19-Apr-17,Interventional,16-Dec-21,,No
